{
  "version": "0.2.0",
  "status": "fixture",
  "principle": "The repository is the starting context, not the prison.",
  "entries": [
    {
      "domain": "personal_llm_os",
      "description": "Valid registry fixture with separated trust fields.",
      "primary_repo": "rezahh107/Personal-LLM-Operating-System",
      "related_repos": [
        {
          "repo": "rezahh107/Prompt-Pipeline",
          "relationship": "domain support repository",
          "verification_status": "source_supported",
          "epistemic_support": "source_supported",
          "lifecycle_status": "active",
          "notes": "Fixture value only."
        }
      ],
      "load_rule": "Load for personal LLM operating behavior.",
      "when_to_use": "Use for boot, routing, trust, and memory policy.",
      "when_not_to_use": "Do not use as a replacement for live repository inspection.",
      "governance_authority": "project_contract",
      "epistemic_support": "observed",
      "verification_status": "tool_observed",
      "lifecycle_status": "active",
      "notes": "Valid fixture: authority, support, verification, and lifecycle are separate."
    }
  ]
}
