{
  "version": "0.2.1",
  "status": "raw_idea_incubator_and_command_routing_seeded",
  "last_reviewed": "2026-07-08",
  "principle": "The repository is the starting context, not the prison.",
  "entries": [
    {
      "domain": "personal_llm_os",
      "description": "Personal operating layer for booting, command routing, raw idea incubation, request routing, governance, and reusable work with language models.",
      "primary_repo": "rezahh107/Personal-LLM-Operating-System",
      "related_repos": [],
      "load_rule": "Load first when the user asks to boot a model session, invoke a repository command, capture a raw idea, route a request, preserve operating memory, or design personal LLM workflow rules.",
      "when_to_use": "Use for session boot, command routing, raw idea capture, user profile, response depth, context routing, knowledge capture, memory governance, trust policy, provenance, verification, and registry lookup.",
      "when_not_to_use": "Do not treat it as a replacement for live GitHub inspection, web/current sources, attached files, or domain repositories. Do not treat raw ideas as accepted memory or verified claims.",
      "governance_authority": "project_contract",
      "epistemic_support": "observed",
      "verification_status": "tool_observed",
      "lifecycle_status": "active",
      "notes": "Repository existence and default branch were verified from live connector evidence. Raw idea incubator and command routing were seeded as architecture-first behavior, not as a complete command registry or automation runtime."
    },
    {
      "domain": "prompt_engineering",
      "description": "Prompt engineering workflow and prompt-as-code support.",
      "primary_repo": "rezahh107/Prompt-Pipeline",
      "related_repos": [
        {
          "repo": "rezahh107/Personal-LLM-Operating-System",
          "relationship": "parent operating layer for routing and memory policy",
          "verification_status": "tool_observed",
          "epistemic_support": "observed",
          "lifecycle_status": "active",
          "notes": "Use this repository for profile, routing, and governance before domain-specific prompt work."
        }
      ],
      "load_rule": "Load after boot when the user asks for serious prompt design, prompt hardening, prompt review, or reusable prompt workflows.",
      "when_to_use": "Use for copy-ready prompts, prompt standards, prompt critique, or prompt pipeline work.",
      "when_not_to_use": "Do not load for casual wording help unless the user wants a reusable or repository-grade prompt.",
      "governance_authority": "advisory",
      "epistemic_support": "source_supported",
      "verification_status": "source_supported",
      "lifecycle_status": "active",
      "notes": "Primary repository came from earlier connector-backed registry context; inspect live files before high-impact use."
    },
    {
      "domain": "repository_audit",
      "description": "Repository inspection, consistency review, PR review, and evidence-led audit work.",
      "primary_repo": null,
      "related_repos": [
        {
          "repo": "rezahh107/Personal-LLM-Operating-System",
          "relationship": "parent operating layer for audit routing and evidence discipline",
          "verification_status": "tool_observed",
          "epistemic_support": "observed",
          "lifecycle_status": "active",
          "notes": "The exact audit-domain implementation repository has not been verified in this registry pass."
        }
      ],
      "load_rule": "Start from this operating repository, then inspect the target repository live through GitHub connector before producing findings.",
      "when_to_use": "Use when the user asks to inspect a repository, PR, issue, schema, workflow, validator, or documentation quality.",
      "when_not_to_use": "Do not use stale memory instead of reading the target repository state.",
      "governance_authority": "advisory",
      "epistemic_support": "unsupported",
      "verification_status": "not_checked",
      "lifecycle_status": "candidate",
      "notes": "Domain is supported by current repository concepts, but no separate primary audit repository was verified during this pass."
    },
    {
      "domain": "github_repair",
      "description": "GitHub repository repair, workflow hardening, CI evidence review, and patch-oriented maintenance.",
      "primary_repo": "rezahh107/GitHub-Actions-Pipeline",
      "related_repos": [
        {
          "repo": "rezahh107/Personal-LLM-Operating-System",
          "relationship": "parent operating layer for routing, scope control, and user-not-technical-verifier policy",
          "verification_status": "tool_observed",
          "epistemic_support": "observed",
          "lifecycle_status": "active",
          "notes": "Use the parent repository for session behavior before domain repair work."
        }
      ],
      "load_rule": "Use only when the task is specifically about GitHub Actions, CI, workflow validation, or repository repair. Also inspect the target repository live.",
      "when_to_use": "Use for CI hardening, workflow review, PR validation evidence, or GitHub repair prompts.",
      "when_not_to_use": "Do not assume this repository covers all GitHub repair domains beyond what is inspected live.",
      "governance_authority": "advisory",
      "epistemic_support": "source_supported",
      "verification_status": "source_supported",
      "lifecycle_status": "candidate",
      "notes": "Primary repository came from earlier connector-backed registry context; inspect live files before high-impact use."
    },
    {
      "domain": "elementor_v4",
      "description": "Elementor V4 architecture, workbook, builder, responsive, constructability, and project-gate workflows.",
      "primary_repo": "rezahh107/EV4-Workbook-Jinja",
      "related_repos": [
        {
          "repo": "rezahh107/EV4-Architect-Repo",
          "relationship": "Elementor V4 architecture repository",
          "verification_status": "source_supported",
          "epistemic_support": "source_supported",
          "lifecycle_status": "active",
          "notes": "Purpose is based on prior connector-backed registry context."
        },
        {
          "repo": "rezahh107/EV4-Constructability-Engineer-Repo",
          "relationship": "Constructability review repository",
          "verification_status": "source_supported",
          "epistemic_support": "source_supported",
          "lifecycle_status": "active",
          "notes": "Purpose is based on prior connector-backed registry context."
        },
        {
          "repo": "rezahh107/EV4-Builder-Assistant-Repo",
          "relationship": "Builder assistant repository",
          "verification_status": "source_supported",
          "epistemic_support": "source_supported",
          "lifecycle_status": "active",
          "notes": "Purpose is based on prior connector-backed registry context."
        },
        {
          "repo": "rezahh107/EV4-Responsive-Architect",
          "relationship": "Responsive architecture repository",
          "verification_status": "source_supported",
          "epistemic_support": "source_supported",
          "lifecycle_status": "active",
          "notes": "Purpose is based on prior connector-backed registry context."
        },
        {
          "repo": "rezahh107/EV4-Project-Gate",
          "relationship": "Project gate / transition repository",
          "verification_status": "source_supported",
          "epistemic_support": "source_supported",
          "lifecycle_status": "active",
          "notes": "Purpose is based on prior connector-backed registry context."
        }
      ],
      "load_rule": "Load when the user asks about Elementor V4, EV4 architecture, workbook generation, builder workflows, responsive design, constructability, or project-gate transitions.",
      "when_to_use": "Use for EV4 domain work after boot and routing, then inspect the specific target repository live.",
      "when_not_to_use": "Do not assume one EV4 repository is canonical for another without inspecting the current target and any shared contract/status docs.",
      "governance_authority": "advisory",
      "epistemic_support": "source_supported",
      "verification_status": "source_supported",
      "lifecycle_status": "active",
      "notes": "Specific file-level purposes should be verified before high-impact work."
    },
    {
      "domain": "image_workflow",
      "description": "Image generation, image editing, portrait workflow, and visual prompt operations.",
      "primary_repo": null,
      "related_repos": [],
      "load_rule": "Use this operating repository for user profile and routing, then use attached images, explicit user instructions, and any future image adapter if added.",
      "when_to_use": "Use when the user asks for image generation, image editing, visual prompt creation, headshot selection, or visual workflow documentation.",
      "when_not_to_use": "Do not infer identity or sensitive visual changes without explicit user instruction and available image context.",
      "governance_authority": "advisory",
      "epistemic_support": "unsupported",
      "verification_status": "not_checked",
      "lifecycle_status": "candidate",
      "notes": "The domain is present in the current repository concept, but no dedicated image-workflow repository was verified during this pass."
    }
  ]
}
